nombre,precio,slug
AH HARAMAIN AMBER OUD GOLD 999 EDP 100ML,$198.500,producto/ah-haramain-amber-oud-gold-999-edp-100ml
AL HARAMAIN AMBER OUD AQUA DUBAI UNISEX 100ML,$188.200,producto/al-haramain-amber-oud-aqua-dubai-unisex-100ml
AL HARAMAIN AMBER OUD RUBY EDITION EDP 100ML,$160.000,producto/al-haramain-amber-oud-ruby-edition-edp-100ml
ARMAF ODYSSEY EUA DE MONTAGNE EDP 100ML,$155.000,producto/armaf-odyssey-eua-de-montagne-edp-100ml
AL HARAMAIN AMBER OUD AQUA DUBAI EDP UNISEX 100ML,$150.500,producto/al-haramain-amber-oud-aqua-dubai-edp-100ml
AL HARAMAIN GOLD EDITION 120ml,$150.000,producto/al-haramain-gold-edition-120ml
BHARARA KING EDP 100ML,$148.000,producto/bharara-king-edp-100ml
ARMAF CLUB D NUIT OUD PARFUM EDP 100ML,$141.600,producto/armaf-club-d-nuit-oud-parfum-edp-100ml
ARMAF CLUB DE NUIT LIONHEART MAN EDP 100ML,$131.000,producto/armaf-club-de-nuit-lionheart-man-edp-100ml
ARMAF ODYSSEY MANDARIN SKY ELIXIR EDP 100ML,$128.000,producto/armaf-odyssey-mandarin-sky-elixir-edp-100ml
ARMAF ODYSSEY ARTISTO EDITION RED EDP 100ML,$128.000,producto/armaf-odyssey-artisto-edition-red-edp-100ml
RASASI HAWAS FIRE EDP UNISEX 100ML,$128.000,producto/rasasi-hawas-fire-edp-unisex-100ml
AL HARAMAIN AMBER OUD DUBAI NIGHT EDP 100ML,$120.000,producto/al-haramain-amber-oud-dubai-night-edp-100ml
AFNAN - Supremacy Gala 100ml,$113.000,producto/afnan-supremacy-gala-100ml
AFNAN 9PM ELIXIR PARFUM 100ML,$110.000,producto/9pm-elixir-parfum-100-ml
AFNAN 9AM DIVE EDP 100ML,$110.000,producto/afnan-9am-dive-edp-100ml
ARMAF CLUB DE NUIT IMPERIAL EDP 105ML,$110.000,producto/armaf-club-de-nuit-imperial-edp-105ml
ARMAF ODYSSEY GO MANGO EDP 100ML,$106.000,producto/armaf-odyssey-go-mango-edp-100ml
AFNAN 9AM (Unisex) 100ML,$104.100,producto/afnan-9am-unisex-100ml
ARMAF BEACH PARTY EDP 100ML,$102.300,producto/armaf-beach-party-edp-100ml
ARMAF CLUB DE NUIT ICONIC EDP 105ML,$102.000,producto/armaf-club-de-nuit-iconic-edp-105ml
ARMAF ODYSSEY AQUA EDP 100ML,$102.000,producto/armaf-odyssey-aqua-edp-100ml
ARMAF ODYSSEY BA-HA-MAS EDP 100ML,$102.000,producto/armaf-odyssey-ba-ha-mas-edp-100ml
AFNAN - Portrait Revival 100ml,$98.000,producto/afnan-portrait-revival-100ml
ARMAF - Checkmate QUEEN 100ml,$98.000,producto/armaf-checkmate-queen-100ml
AL HARAMAIN AMBER OUD GOLD EDP UNISEX 120ML,$96.000,producto/al-haramain-amber-oud-gold-edp-unisex-120ml
ARMAF CLUB DE NUIT SILLAGE EDP 105ML,$92.500,producto/armaf-club-de-nuit-sillage-edp-105ml
Perfume Lattafa Emeer Eau De Parfum Femenino 100ml Alternativo,$91.800,producto/perfume-lattafa-emeer-eau-de-parfum-femenino-100ml-alternativo
ARMAF CLUB DE NUIT INTENSE EDT 105ML,$90.000,producto/armaf-club-de-nuit-intense-edt-105ml
FRENCH AVENUE VULCAN FEU EDP 100ML,$90.000,producto/french-avenue-vulcan-feu-edp-100ml
Perfume Al Haramain Amber Bleu 60ml Alternativo,$88.600,producto/perfume-al-haramain-amber-bleu-60ml-alternativo
Perfume Al Haramain Amber Oud Ruby 60ml Alternativo,$88.600,producto/perfume-al-haramain-amber-oud-ruby-60ml-alternativo
Perfume Bharara Viking Dubai100ml Alternativo,$87.400,producto/perfume-bharara-viking-dubai100ml-alternativo
Perfume Bharara Viking Rio 100ml Alternativo,$87.400,producto/perfume-bharara-viking-rio-100ml-alternativo
Perfume Bharara Viking Cairo 100ml Alternativo,$87.400,producto/perfume-bharara-viking-cairo-100ml-alternativo
Perfume Bharara Viking Beirut 100ml Alternativo,$87.400,producto/perfume-bharara-viking-beirut-100ml-alternativo
ARMAF CLUB DE NUIT URBAN MAN ELIXIR EDP 105ML,$86.500,producto/armaf-club-de-nuit-urban-man-elixir-edp-105ml
AFNAN - Supremacy Tapis Rouge 100ml,$86.500,producto/afnan-supremacy-tapis-rouge-100ml
Perfume G5 French Avenue Veneno Bianco Masc 100ml,$86.400,producto/perfume-g5-french-avenue-veneno-bianco-masc-100ml
Perfume G5 French Avenue Veneno Black Masculino 100ml,$86.400,producto/perfume-g5-french-avenue-veneno-black-masculino-100ml
ARMAF CLUB DE NUIT WOMAN EDP 105ML,$85.000,producto/armaf-club-de-nuit-woman-edp-105ml
AFNAN 9PM POUR FEMME VIOLETA EDP 100ML,$81.000,producto/afnan-9pm-pour-femme-violeta-edp-100ml
AFNAN - Turathi Electric 90ml,$80.700,producto/afnan-turathi-electric-90ml
KHAMRAH BLACK 100ml,$80.000,producto/khamrah-black-100ml
AFNAN 9AM BLANCO EDP 100ML,$80.000,producto/afnan-9am-blanco-edp-100ml
Perfume G5 Armaf Club De Nuit Oud Fem 100ml,$79.400,producto/perfume-g5-armaf-club-de-nuit-oud-fem-100ml
Perfume Eclaire Lattafa Black 100ml Alternativo,$79.200,producto/perfume-eclaire-lattafa-black-100ml-alternativo
LATTAFA ASAD 100ML,$78.000,producto/lattafa-asad-100ml
AFNAN - Souvenir Floral Bouquet EDP 100ml,$78.000,producto/afnan-souvenir-floral-bouquet-edp-100ml
Perfume Generico Yum Yum Femenino G5 100ml,$76.800,producto/perfume-generico-yum-yum-femenino-g5-100ml
Perfume Island Bliss Armaf 100ml Alternativo,$76.400,producto/perfume-island-bliss-armaf-100ml-alternativo
MAISON ALHAMBRA PHILOS PURA 100ML,$76.000,producto/maison-alhambra-philos-pura-100ml
ARMAF ODYSSEY MANDARIN SKY EDP 100ML,$75.000,producto/armaf-odyssey-mandarin-sky-edp-100ml
Yd Erba Pura (Extracto) 120ml,$73.000,producto/yd-erba-pura-extracto-120ml
Perfume Generico Al Haramain Amber Oud Gold Black Masculino G5 100ml,$73.000,producto/perfume-generico-al-haramain-amber-oud-gold-black-masculino-g5-100ml
Perfume Generico Bharah Kin Rose Femenino G5 100ml + Decant,$71.400,producto/perfume-generico-bharah-kin-rose-femenino-g5-100ml-decant
Perfume G5 Al Haramain Amber Oud Private Edition 100ml,$71.200,producto/perfume-g5-al-haramain-amber-oud-private-edition-100ml
Perfume G5 Al Haramain Amber Oud Gold Edition 60ml,$71.200,producto/perfume-g5-al-haramain-amber-oud-gold-edition-60ml
Perfume Armaf Delights Yum Yum Eau de Parfum Femenino 100ml Alternativo,$71.200,producto/perfume-armaf-delights-yum-yum-eau-de-parfum-femenino-100ml-alternativo
Perfume Generico Xerjoff Coro Femenino G5 100ml,$71.200,producto/perfume-generico-xerjoff-coro-femenino-g5-100ml
Perfume Eclaire Lattafa 100ml Alternativo,$71.200,producto/perfume-eclaire-lattafa-100ml-alternativo
Perfume Generico Club De Nuit Lionheart Masc G5 100ml,$71.200,producto/perfume-generico-club-de-nuit-lionheart-masc-g5-100ml
Perfume Generico Lataffa His Confession Masc G5 100ml,$71.200,producto/perfume-generico-lataffa-his-confession-masc-g5-100ml
Perfume Xerjoff Soprano Eau de Parfum 100ml unisex Alternativo G5,$71.200,producto/perfume-xerjoff-soprano-eau-de-parfum-100ml-unisex-alternativo-g5
Perfume Xerjoff Opera Eau de Parfum 100ml unisex Alternativo,$71.200,producto/perfume-xerjoff-opera-eau-de-parfum-100ml-unisex-alternativo
Perfume Xerjoff Coro Eau de Parfum 100ml unisex Alternativo,$71.200,producto/perfume-xerjoff-coro-eau-de-parfum-100ml-unisex-alternativo
Xerjoff Accento Perfume Sobredosis 100ml Alternativo,$71.200,producto/xerjoff-accento-perfume-sobredosis-100ml-alternativo
"Perfume Xerjoff Erba Gold Eau de Parfum, 100ml unisex Alternativo",$71.200,producto/perfume-xerjoff-erba-gold-eau-de-parfum-100ml-unisex-alternativo
Perfume Lattafa Her Confession 100ml Alternativo,$71.200,producto/perfume-lattafa-her-confession-100ml-alternativo
Perfume Orientica Amber Noir 100ml Alternativo,$71.200,producto/perfume-orientica-amber-noir-100ml-alternativo
Perfume Bharara King Chocolate Unisex G5 100ml,$71.200,producto/perfume-bharara-king-chocolate-unisex-g5-100ml
Perfume Bharara King Bleu Unisex G5 100ml,$71.200,producto/perfume-bharara-king-bleu-unisex-g5-100ml
Perfume Bharara King Niche Unisex G5 100ml,$71.200,producto/perfume-bharara-king-niche-unisex-g5-100ml
Perfume Bayaan Gold 100ml Alternativo 100ml G5,$71.200,producto/perfume-bayaan-gold-100ml-alternativo-100ml-g5
Perfume Bayaan 100ml Alternativo 100ml,$71.200,producto/perfume-bayaan-100ml-alternativo-100ml
Perfume Lattafa Maahir Black 100ml Alternativo,$71.200,producto/perfume-lattafa-maahir-black-100ml-alternativo
Perfume Lattafa Maahir Silver 100ml Alternativo,$71.200,producto/perfume-lattafa-maahir-silver-100ml-alternativo
Perfume Lattafa Maahir Gold 100ml Alternativo,$71.200,producto/perfume-lattafa-maahir-gold-100ml-alternativo
Perfume Lattafa Qaaed Edp 100ml Alternativo G5,$71.200,producto/perfume-lattafa-qaaed-edp-100ml-alternativo-g5
Perfume G5 JPG Le Male Le Beau Masc 100ml,$71.200,producto/perfume-g5-jpg-le-male-le-beau-masc-100ml
Perfume G5 JPG Le Male Elixir Masc 100ml,$71.200,producto/perfume-g5-jpg-le-male-elixir-masc-100ml
Perfume G5 JPG Le Male Le Parfum Masc 100ml,$71.200,producto/perfume-g5-jpg-le-male-le-parfum-masc-100ml
Perfume Generico Xerjjof Erba Pura Unisex 100ml,$71.200,producto/perfume-generico-xerjjof-erba-pura-unisex-100ml
Perfume Generico Xerjoff Ouverture Unisex 100ml,$70.800,producto/perfume-generico-xerjoff-ouverture-unisex-100ml
RASASI HAWAS FOR HIM EDP 100ML,$70.000,producto/rasasi-hawas-for-him-edp-100ml
Perfume Generico G5 Xerjoff Opera Unisex 100ml,$67.200,producto/perfume-generico-g5-xerjoff-opera-unisex-100ml
Perfume Generico Xerjoff Soprano Unisex 100ml Femenino,$67.200,producto/perfume-generico-xerjoff-soprano-unisex-100ml-femenino
ARMAF ODYSSEY CANDEE EDP 100ML,$67.000,producto/armaf-odyssey-candee-edp-100ml-1
LATTAFA AL QIAM GOLD EDP 100ML,$67.000,producto/lattafa-al-qiam-gold-edp-100ml
LATTAFA ISHQ AL SHUYUKH GOLD EDP 100ML,$67.000,producto/lattafa-ishq-al-shuyukh-gold-edp-100ml
ARMAF ODYSSEY CANDEE EDP 100ML,$66.500,producto/armaf-odyssey-candee-edp-100ml
ARMAF ODYSSEY HOMME WHITE EDP 100ML,$66.500,producto/armaf-odyssey-homme-white-edp-100ml
ARMAF ODYSSEY LIMONI EDP 100ML,$65.000,producto/armaf-odyssey-limoni-edp-100ml
ARMAF ODYSSEY MEGA EDP 100ML,$65.000,producto/armaf-odyssey-mega-edp-100ml
Perfume Árabe Island Bliss Delights 100ml | Armaf,$65.000,producto/perfume-arabe-island-bliss-delights-100ml-or-armaf
Pefume Generico Khamrah Qhawa Unisex G5 100ml,$64.800,producto/pefume-generico-khamrah-qhawa-unisex-g5-100ml
Pefume Generico Khamrah G5 Unisex 100ml,$64.800,producto/pefume-generico-khamrah-g5-unisex-100ml
HAWAS FOR HIM MALIBU 100ml,$64.326,producto/hawas-for-him-malibu-100ml
LATTAFA BADEE AL OUD FOR GLORY UNISEX 100ML,$64.000,producto/lattafa-badee-al-oud-for-glory-unisex-100ml
AFNAN - Supremacy Noir 100ml,$64.000,producto/afnan-supremacy-noir-100ml
ARMAF ODYSSEY REVOLUTION ULTRA EDITION EDP 100ML,$63.700,producto/armaf-odyssey-revolution-ultra-edition-edp-100ml
Perfume Orientica Royal Amber 100ml Alternativo,$63.400,producto/perfume-orientica-royal-amber-100ml-alternativo
Perfume Orientica Royal Bleu 100ml Alternativo,$63.400,producto/perfume-orientica-royal-bleu-100ml-alternativo
Perfume Orientica Amber Rouge 100ml Alternativo,$63.400,producto/perfume-orientica-amber-rouge-100ml-alternativo
Perfume French Avenue Vulcan Generico G5 EDP 100ml unisex tropical,$63.400,producto/perfume-french-avenue-vulcan-generico-g5-edp-100ml-unisex-tropical
French Avenue Vulcan Black Generico G5 EDP Masculino 100ml,$63.400,producto/french-avenue-vulcan-black-generico-g5-edp-masculino-100ml
Perfume Lattafa Maahir 100ml Alternativo,$63.400,producto/perfume-lattafa-maahir-100ml-alternativo
Perfume Lattafa Now Rave For Women 100ml,$63.400,producto/perfume-lattafa-now-rave-for-women-100ml
Perfume Lataffa Emaan 100ml Alternativo,$63.400,producto/perfume-lataffa-emaan-100ml-alternativo
Perfume Lataffa Sakeena 100ml Alternativo,$63.400,producto/perfume-lataffa-sakeena-100ml-alternativo
Perfume Lataffa Haya 100ml Alternativo,$63.400,producto/perfume-lataffa-haya-100ml-alternativo
ARMAF ODYSSEY DUBAI CHOCOLAT EDP UNISEX 100ML,$61.000,producto/armaf-odyssey-dubai-chocolat-edp-unisex-100ml
ARMAF ODYSSEY DUBAI CHOCOLAT EDP 100ML,$61.000,producto/armaf-odyssey-dubai-chocolat-edp-100ml
AFNAN 9PM EDP 100ML,$60.000,producto/afnan-9pm-edp-100ml
LATTAFA YARA ROSA WOMAN 100ML,$60.000,producto/lattafa-yara-rosa-woman-100ml
LATAFFA YARA TOUS AMARILLO WOMAN 100ML,$60.000,producto/lataffa-yara-tous-amarillo-woman-100ml
L'uomo Elixir 120ml,$60.000,producto/luomo-elixir-120ml
L'uomo Dark 100ml,$60.000,producto/luomo-dark-100ml
Set de Perfumes Árabes Pride 20Ml 5 Pzas.,$60.000,producto/set-de-perfumes-arabes-pride-20ml-5-pzas
Set 2 de Perfumes Árabes Pride 20Ml 5 Pzas.,$60.000,producto/set-2-de-perfumes-arabes-pride-20ml-5-pzas
Set 3 de Perfumes Árabes Pride 20Ml 5 Pzas.,$60.000,producto/set-3-de-perfumes-arabes-pride-20ml-5-pzas
Set 4 de Perfumes Árabes Pride 20Ml 5 Pzas.,$60.000,producto/set-4-de-perfumes-arabes-pride-20ml-5-pzas
Set 5 de Perfumes Árabes Pride 20Ml 5 Pzas.,$60.000,producto/set-5-de-perfumes-arabes-pride-20ml-5-pzas
Perfume Generico Lataffa Khamrah Dukhan Unisex G5 100ml,$58.600,producto/perfume-generico-lataffa-khamrah-dukhan-unisex-g5-100ml
Perfume Generico Khamrah Masculino G5 100ml,$58.600,producto/perfume-generico-khamrah-masculino-g5-100ml
Perfume Generico French Avenue Elysian Black Masculino G5 100ml,$58.600,producto/perfume-generico-french-avenue-elysian-black-masculino-g5-100ml
Perfume Generico French Avenue Elysian Masculino G5 100ml,$58.600,producto/perfume-generico-french-avenue-elysian-masculino-g5-100ml
Perfume G5 Billie Eilish Parfum Fem 100ml,$58.600,producto/perfume-g5-billie-eilish-parfum-fem-100ml
Perfume ISHQ Silver Lataffa 100ml Alternativo,$58.600,producto/perfume-ishq-silver-lataffa-100ml-alternativo
Perfume Generico Khamrah Zanaqah Masculino G5 100ml,$58.600,producto/perfume-generico-khamrah-zanaqah-masculino-g5-100ml
Perfume Lataffa Khamrah Karaz Masculino G5 100ml,$58.600,producto/perfume-lataffa-khamrah-karaz-masculino-g5-100ml
Perfume Arabe Khamrah Dukhan 100ml Alternativo G5,$58.600,producto/perfume-arabe-khamrah-dukhan-100ml-alternativo-g5
Perfume Lattafa Confidential Private Gold Unissex 100ml Alternativo G5,$58.600,producto/perfume-lattafa-confidential-private-gold-unissex-100ml-alternativo-g5
Perfume Generico Armaf Odyssey Marshmallow Gourmand Edition G5 Unisex,$58.600,producto/perfume-generico-armaf-odyssey-marshmallow-gourmand-edition-g5-unisex
Perfume Generico Armaf Toffee Caffee Edicion G5 Unisex 100ml,$58.600,producto/perfume-generico-armaf-toffee-caffee-edicion-g5-unisex-100ml
Perfume Generico Odyssey Ultra Edition G5 Masculino 100ml,$58.600,producto/perfume-generico-odyssey-ultra-edition-g5-masculino-100ml
Perfume Lattafa Al Noble Ameer Unissex 100ml Alternativo,$58.600,producto/perfume-lattafa-al-noble-ameer-unissex-100ml-alternativo
Perfume Lattafa Al Noble Wazeer Unissex 100ml Alternativo,$58.600,producto/perfume-lattafa-al-noble-wazeer-unissex-100ml-alternativo
Perfume Lattafa Al Noble Safeer Unissex 100ml Alternativo,$58.600,producto/perfume-lattafa-al-noble-safeer-unissex-100ml-alternativo
Perfume Generico Rarasi Hawas Fire Masc G5 100ml,$58.600,producto/perfume-generico-rarasi-hawas-fire-masc-g5-100ml
Perfume Generico Hawas Fire Masc G5 100ml,$58.600,producto/perfume-generico-hawas-fire-masc-g5-100ml
Arab - Sheik Bourbon 100ml,$58.000,producto/arab-sheik-bourbon-100ml
Arab - Sheik 100ml,$58.000,producto/arab-sheik-100ml
Set De Perfume Gissah 30ml c/u x5,$58.000,producto/set-de-perfume-gissah-30ml-cu-x5
Set De Perfume 9Am Pm G5 30ml x4,$58.000,producto/set-de-perfume-9am-pm-g5-30ml-x4
Set de perfume Odyssey Limoni G5 30ml x 4,$58.000,producto/set-de-perfume-odyssey-limoni-g5-30ml-x-4
Set de perfume Eclaire G5 30ml x 5,$58.000,producto/set-de-perfume-eclaire-g5-30ml-x-5
Set de perfume Odyssey Candee G5 30ml x 4,$58.000,producto/set-de-perfume-odyssey-candee-g5-30ml-x-4
LATTAFA KHAMRAH DUKHAN EDP 100ML,$57.000,producto/lattafa-khamrah-dukhan-edp-100ml
LATTAFA YARA CANDY WOMAN 100ML,$57.000,producto/lattafa-yara-candy-woman-100ml
Perfume Lataffa Mayar 100ml Alternativo,$57.000,producto/perfume-lataffa-mayar-100ml-alternativo
Perfume Árabe Vanilla Freak 75ml | Lattafa,$56.000,producto/perfume-arabe-vanilla-freak-75ml-or-lattafa
Perfume Lattafa Noble Blush Alternativo 100ml,$55.600,producto/perfume-lattafa-noble-blush-alternativo-100ml
Perfume Generico Lattafa Honor Y Glory G5 100ml Unisex,$55.200,producto/perfume-generico-lattafa-honor-y-glory-g5-100ml-unisex
Perfume Generico Lattafa Oud For Glory Amethyst G5 100ml Unisex,$55.200,producto/perfume-generico-lattafa-oud-for-glory-amethyst-g5-100ml-unisex
MAISON ALHAMBRA SALVO INTENSE 100ML,$55.000,producto/maison-alhambra-salvo-intense-100ml
Yd12 Skate Women 85ml,$54.600,producto/yd12-skate-women-85ml
Lataffa Fakhar Gold Extrait EDP 100ml Alternativo,$54.600,producto/lataffa-fakhar-gold-extrait-edp-100ml-alternativo
Lattafa Pride Al Qiam Gold Eau de Parfum 100Ml Alternativo G5,$54.600,producto/lattafa-pride-al-qiam-gold-eau-de-parfum-100ml-alternativo-g5
Lattafa Tharwah Gold 100ml Alternativo G5,$54.600,producto/lattafa-tharwah-gold-100ml-alternativo-g5
Lattada Tharwah Silver 100ml Alternativo G5,$54.600,producto/lattada-tharwah-silver-100ml-alternativo-g5
Perfume Generico Hersh Tahar G5 Unisex 100ml,$54.600,producto/perfume-generico-hersh-tahar-g5-unisex-100ml
Perfume Generico 9am Dive Afnan G5 Masc 100ml,$54.600,producto/perfume-generico-9am-dive-afnan-g5-masc-100ml
Perfume Generico 9pm Rebel Afnan G5 Masc 100ml,$54.600,producto/perfume-generico-9pm-rebel-afnan-g5-masc-100ml
Perfume G5 Odyssey Montagne Masc 100ml,$54.600,producto/perfume-g5-odyssey-montagne-masc-100ml
Perfume G5 Odyssey Ba Ha Mas Masc 100ml,$54.600,producto/perfume-g5-odyssey-ba-ha-mas-masc-100ml
Perfume Generico Odyssey Go Mango Unisex G5,$54.600,producto/perfume-generico-odyssey-go-mango-unisex-g5
Perfume Generico Odyssey Black Forest Unisex G5 100ml,$54.600,producto/perfume-generico-odyssey-black-forest-unisex-g5-100ml
Perfume Odyssey Aqua 100ml Alternativo,$54.600,producto/perfume-odyssey-aqua-100ml-alternativo
Perfume Armaf Odyssey Wild One Gold Edition Masculino 100ml Alternativo,$54.600,producto/perfume-armaf-odyssey-wild-one-gold-edition-masculino-100ml-alternativo
Perfume Armaf Odyssey Candee Femenino 100ml Alternativo,$54.600,producto/perfume-armaf-odyssey-candee-femenino-100ml-alternativo
Perfume Armaf Odyssey Tyrant Special Edition Masculino 100ml alternativo,$54.600,producto/perfume-armaf-odyssey-tyrant-special-edition-masculino-100ml-alternativo
Perfume Armaf Odyssey Limoni Fresh Unissex 100ml Alternativo,$54.600,producto/perfume-armaf-odyssey-limoni-fresh-unissex-100ml-alternativo
Perfume Eclaire Lattafa Red 100ml Alternativo,$54.600,producto/perfume-eclaire-lattafa-red-100ml-alternativo
Perfume Eclaire Lattafa White 100ml Alternativo,$54.600,producto/perfume-eclaire-lattafa-white-100ml-alternativo
Perfume Eclaire Lattafa Blue 100ml Alternativo,$54.600,producto/perfume-eclaire-lattafa-blue-100ml-alternativo
Perfume Armaf Odyssey Homme 100ml Alternativo,$54.600,producto/perfume-armaf-odyssey-homme-100ml-alternativo
Perfume Generico Santal 33 Le Labo Masculino G5 100ml,$54.600,producto/perfume-generico-santal-33-le-labo-masculino-g5-100ml
Perfume Hawas Pink 100ml Alternativo,$54.600,producto/perfume-hawas-pink-100ml-alternativo
Perfume Hawas Black 100ml Alternativo,$54.600,producto/perfume-hawas-pink-100ml-alternativoperfume-hawas-black-100ml-alternativo
Perfume Hawas Ice 100ml Alternativo,$54.600,producto/perfume-hawas-ice-100ml-alternativo
Perfume Hawas Elixir de Rasas 100ml Alternativo,$54.600,producto/perfume-hawas-elixir-de-rasas-100ml-alternativo
Perfume Armaf Odyssey AOUD 100ml Alternativo,$54.600,producto/perfume-armaf-odyssey-aoud-100ml-alternativo
Perfume G5 Armaf Club De Nuit Sillage 100ml,$54.600,producto/perfume-g5-armaf-club-de-nuit-sillage-100ml
Perfume Generico Lateen concentrated G5 100ml,$54.600,producto/perfume-generico-lateen-concentrated-g5-100ml
Perfume Generico Hamidi Lateen unisex G5 100ml,$54.600,producto/perfume-generico-hamidi-lateen-unisex-g5-100ml
Perfume Egil Parfum 100ml Alternativo G5,$54.600,producto/perfume-egil-parfum-100ml-alternativo-g5
Perfume Generico Hawas Atlantis Unisex G5 100ml,$54.600,producto/perfume-generico-hawas-atlantis-unisex-g5-100ml
Perfume Lattafa Now Intense 100ml Alternativo,$54.600,producto/perfume-lattafa-now-intense-100ml-alternativo
Perfume Lattafa Bade'e Al Oud Oud For Glory 100ml Alternativo,$54.600,producto/perfume-lattafa-badee-al-oud-oud-for-glory-100ml-alternativo
Perfume Lattafa Shaheen Silver 100ml Alternativo,$54.600,producto/perfume-lattafa-shaheen-silver-100ml-alternativo
Lattafa Shaheen Gold 100ml Alternativo,$54.600,producto/lattafa-shaheen-gold-100ml-alternativo
